### ISSUE TITLE
[infoblox] framestream reader error: frame too large error

### ISSUE THREAD

**Issue by jerrishjmz** [dmachard/DNS-collector#1217]
**Describe the bug**
When receiving dnstap streams from Infoblox, DNS‑collector intermittently fails to process incoming connections. The collector logs show repeated errors such as:

framestream reader error: frame too large error
unexpected control framestream: control frame malformed

These errors cause the collector to terminate connections (TCP RST), resulting in log loss and incomplete processing of dnstap messages.

**Logs**

```
ERROR: worker - [tap] dnstap - conn #3 - unexpected control framestream: control frame malformed
ERROR: worker - [tap] dnstap - conn #5 - unexpected control framestream: control frame malformed
ERROR: worker - [tap] dnstap - conn #6 - framestream reader error: frame too large error
ERROR: worker - [tap] dnstap - conn #7 - unexpected control framestream: control frame malformed
ERROR: worker - [tap] dnstap - conn #9 - framestream reader error: frame too large error
ERROR: worker - [tap] dnstap - conn #10 - framestream reader error: frame too large error
ERROR: worker - [tap] dnstap - conn #11 - unexpected control framestream: control frame malformed
ERROR: worker - [tap] dnstap - conn #8 - framestream reader error: frame too large error
ERROR: worker - [tap] dnstap - conn #12 - unexpected control framestream: control frame malformed
ERROR: worker - [tap] dnstap - conn #13 - framestream reader error: frame too large error
ERROR: worker - [tap] dnstap - conn #14 - framestream reader error: frame too large error
ERROR: worker - [tap] dnstap - conn #16 - framestream reader error: frame too large error
ERROR: worker - [tap] dnstap - conn #17 - framestream reader error: frame too large error

```

the same time:

TCP sessions are reset by the collector (confirmed via tcpdump)
Infoblox repeatedly reconnects
Some dnstap data is not received or lost(complete) 

**TCP DUMP FROM THE INOFBLOX SERVER** 

Filter for RST alone

```
09:43:55.108461 IP Infoblox.6000 > DNSTAPcOLLECTOR.29750: Flags [R], seq 3624393308, win 0, length 0
09:44:25.333841 IP Infoblox.6000 > DNSTAPcOLLECTOR.29749: Flags [R.], seq 2749224544, ack 3506189907, win 669, options [nop,nop,TS val 1191304737 ecr 3444127185], length 0
09:44:55.088276 IP Infoblox.6000 > DNSTAPcOLLECTOR.29748: Flags [R.], seq 2282418673, ack 2312280895, win 669, options [nop,nop,TS val 1191334491 ecr 3444156940], length 0
09:45:25.511766 IP Infoblox.6000 > DNSTAPcOLLECTOR.29747: Flags [R.], seq 1557304608, ack 1120250840, win 669, options [nop,nop,TS val 1191364915 ecr 3444187363], length 0
09:45:25.511902 IP Infoblox.6000 > DNSTAPcOLLECTOR.29747: Flags [R], seq 1557304608, win 0, length 0
09:45:55.393721 IP Infoblox.6000 > DNSTAPcOLLECTOR.29746: Flags [R.], seq 393384348, ack 4216841587, win 669, options [nop,nop,TS val 1191394797 ecr 3444217245], length 0
09:45:55.393858 IP Infoblox.6000 > DNSTAPcOLLECTOR.29746: Flags [R], seq 393384348, win 0, length 0
09:45:55.393859 IP Infoblox.6000 > DNSTAPcOLLECTOR.29746: Flags [R], seq 393384348, win 0, length 0
09:46:25.693404 IP Infoblox.6000 > DNSTAPcOLLECTOR.29745: Flags [R.], seq 1356224356, ack 3033344786, win 669, options [nop,nop,TS val 1191425096 ecr 3444247545], length 0
09:46:55.251442 IP Infoblox.6000 > DNSTAPcOLLECTOR.29744: Flags [R.], seq 4275239421, ack 1845187726, win 669, options [nop,nop,TS val 1191454654 ecr 3444277103], length 0
09:47:25.310998 IP Infoblox.6000 > DNSTAPcOLLECTOR.29743: Flags [R.], seq 3665579163, ack 641170984, win 669, options [nop,nop,TS val 1191484714 ecr 3444307162], length 0
09:47:55.151371 IP Infoblox.6000 > DNSTAPcOLLECTOR.29742: Flags [R.], seq 1091614520, ack 3750922263, win 669, options [nop,nop,TS val 1191514554 ecr 3444337003], length 0
09:48:25.316359 IP Infoblox.6000 > DNSTAPcOLLECTOR.29741: Flags [R.], seq 3223098498, ack 2561005478, win 669, options [nop,nop,TS val 1191544719 ecr 3444367167], length 0
09:48:55.077238 IP Infoblox.6000 > DNSTAPcOLLECTOR.29740: Flags [R.], seq 1526221506, ack 1365447205, win 669, options [nop,nop,TS val 1191574480 ecr 3444396928], length 0
09:49:25.051955 IP Infoblox.6000 > DNSTAPcOLLECTOR.29739: Flags [R.], seq 3818387364, ack 173449880, win 669, options [nop,nop,TS val 1191604455 ecr 3444426903], length 0
09:49:55.606619 IP Infoblox.6000 > DNSTAPcOLLECTOR.29738: Flags [R.], seq 4155468112, ack 3277538089, win 669, options [nop,nop,TS val 1191635010 ecr 3444457458], length 0
09:50:25.548485 IP Infoblox.6000 > DNSTAPcOLLECTOR.29737: Flags [R.], seq 2776160266, ack 2089802323, win 669, options [nop,nop,TS val 1191664951 ecr 3444487400], length 0
09:50:55.242417 IP Infoblox.6000 > DNSTAPcOLLECTOR.29736: Flags [R.], seq 4008504613, ack 895235149, win 669, options [nop,nop,TS val 1191694645 ecr 3444517093], length 0 
```

**Environment**

DNS‑collector version: v2.2.0
Transport: TCP (non-TLS)
Sender: Infoblox (dnstap enabled) LAB around 6k/s QPS simulated

**Questions / feedback**

Is there a configurable maximum framestream frame size for dnstap input?
Are large frames from Infoblox expected to be supported?
Is this a known compatibility limitation with Infoblox dnstap?
Would upgrading to a newer version improve handling of large frames?
Are there recommended settings or workarounds for high‑volume / large‑frame environments?

**Comment by dmachard** [comment]
Thanks for the detailed report and logs.

The errors you are seeing come from the FrameStream control frame parser used by DNS-collector (via the Go library [go-framestream](https://github.com/dmachard/go-framestream)).

DNS-collector currently enforces a strict maximum control frame size:

`const CONTROL_FRAME_LENGTH_MAX = 4064
`

Any control frame larger than this value will be rejected with: **ErrControlFrameTooLarge**

This is a hard limit in the current implementation.

Since everything works correctly with open-source DNS/dNSTAP implementations, the issue is very likely due to Infoblox sending control frames that differ slightly in size or structure from what go-framestream strictly expects

Could you share a PCAP file of the initial FrameStream handshake? It would help to verify the exact control frames being exchanged. It’s possible that additional vendor-specific fields are present compared to open-source senders.

**Comment by jerrishjames** [comment]
Here is the capture  , i hope this will help 

[fullcsv.csv](https://github.com/user-attachments/files/27641627/fullcsv.csv)

[bogus frame.json](https://github.com/user-attachments/files/27642983/bogus.frame.json)

For your reference 

[https://docs.infoblox.com/space/nios90/1432715617/About+dnstap+Implementation](https://urldefense.com/v3/__https:/docs.infoblox.com/space/nios90/1432715617/About*dnstap*Implementation__;Kys!!MXpALLYS!UrwIdOjnD9EXdpQwyRK7Wd6B3mIJM4nvvuYvhiSIBoPvkrWgxVb7aNOVjeW3bQbFG2H1tMwzvArLv3rmjNd15PrcfuacQxIcRA$)
[https://docs.infoblox.com/space/nios90/1432781072/Protobuf+Template+for+Infoblox+dnstap](https://urldefense.com/v3/__https:/docs.infoblox.com/space/nios90/1432781072/Protobuf*Template*for*Infoblox*dnstap__;KysrKw!!MXpALLYS!UrwIdOjnD9EXdpQwyRK7Wd6B3mIJM4nvvuYvhiSIBoPvkrWgxVb7aNOVjeW3bQbFG2H1tMwzvArLv3rmjNd15PrcfuYezgeRww$)

**Comment by jerrishjames** [comment]
we observed a control frame of ~10.9 KB from an Infoblox .

Since control frames are transported over TCP and can be split across multiple segments, their total size appears to depend on sender-specific metadata and is not fixed.

Given this, would it be more appropriate for the parser to dynamically allocate based on the declared frame length rather than enforcing a hardcoded limit (4064 bytes)?

Is there a specific reason for not allowing larger (but valid) control frames, or could this be safely handled by removing or relaxing the fixed limit?


or is there any limitation to this ? And also when you say opensource i think you primarily  refers to BIND and i dont see any specific size for it.

**Comment by dmachard** [comment]
Thanks for the additional details and captures.

A ~10.9 KB control frame is definitely much larger than what DNS-collector currently expects. The original limit was mainly added as a defensive safeguard to avoid unbounded allocations or malformed framestream abuse, since typical dnstap implementations (BIND, Unbound, Knot, PowerDNS, etc.) use very small control frames.

I’ll review the parser behavior and see if we can safely relax the limit

**Comment by dmachard** [comment]
A new beta release [(2.3.0-beta4)](https://github.com/dmachard/DNS-collector/releases/tag/v2.3.0-beta4) is available, you can now add the following to your config.yml:

```
yaml
global:
  framestream:
    # Increase control frame limit to support Infoblox large frames (e.g., 16KB)
    control-frame-max-length: 16384
    # You can also increase the data frame limit if needed (e.g., 1MB)
    data-frame-max-length: 1048576
```

Please let me know if this beta version resolves the connection resets

**Comment by jerrishjames** [comment]
i did some test today still issue persist.


I tried increasing the data-frame  8,16 32 and finally 64 MB and control-frame -> tired till 64kb

```
global:
  framestream:
    control-frame-max-length: 65536     
    data-frame-max-length: 16777216  
    content-type: "protobuf:dnstap.Dnstap"

```
```
INFO: 2026/05/18 13:08:03.015295 worker - [tap] (conn #325) transformers applied: [normalize:qname-replace-nonprintable normalize:qname-lowercase]
INFO: 2026/05/18 13:08:03.016434 worker - [tap] dnstap - conn #325 - receiver framestream initialized
ERROR: 2026/05/18 13:08:03.128419 worker - [tap] dnstap - **conn #325 - framestream reader error: frame too large error**
INFO: 2026/05/18 13:08:03.128450 worker - [tap] dnstap - (conn #325 - connection handler terminated
INFO: 2026/05/18 13:08:03.128489 worker - [tap] dnstap - conn #325 - cleanup the connection handler
INFO: 2026/05/18 13:08:03.128498 worker - [tap] (conn #325) dnstap processor - stopping collect...
INFO: 2026/05/18 13:08:03.128503 worker - [tap] (conn #325) dnstap processor - collection terminated
INFO: 2026/05/18 13:08:03.128507 worker - [tap] (conn #325) dnstap processor - stopping monitor...
INFO: 2026/05/18 13:08:03.128513 worker - [tap] (conn #325) dnstap processor - monitor terminated
INFO: 2026/05/18 13:08:03.128517 worker - [tap] dnstap - conn #325 - cleanup connection handler terminated
INFO: 2026/05/18 13:08:13.015465 worker - [tap] dnstap - conn #326 - new connection from infoblox IP:29280 (NAME.)
INFO: 2026/05/18 13:08:13.015501 worker - [tap] (conn #326) dnstap processor - enabled
INFO: 2026/05/18 13:08:13.018210 worker - [tap] (conn #326) dnstap processor - starting monitoring - refresh every 10s
INFO: 2026/05/18 13:08:13.018257 worker - [tap] (conn #326) dnstap processor - starting data collection
INFO: 2026/05/18 13:08:13.018309 worker - [tap] (conn #326) transformers applied: [normalize:qname-replace-nonprintable normalize:qname-lowercase]
INFO: 2026/05/18 13:08:13.019185 worker - [tap] dnstap - conn #326 - receiver framestream initialized
ERROR: 2026/05/18 13:08:13.652551 worker - [tap] dnstap - conn #326 - **framestream reader error: frame too large error**
INFO: 2026/05/18 13:08:13.652585 worker - [tap] dnstap - (conn #326 - connection handler terminated
INFO: 2026/05/18 13:08:13.652672 worker - [tap] dnstap - conn #326 - cleanup the connection handler
INFO: 2026/05/18 13:08:13.652688 worker - [tap] (conn #326) dnstap processor - stopping collect...
INFO: 2026/05/18 13:08:13.652699 worker - [tap] (conn #326) dnstap processor - collection terminated
INFO: 2026/05/18 13:08:13.652703 worker - [tap] (conn #326) dnstap processor - stopping monitor...
INFO: 2026/05/18 13:08:13.652722 worker - [tap] (conn #326) dnstap processor - monitor terminated
INFO: 2026/05/18 13:08:13.652739 worker - [tap] dnstap - conn #326 - cleanup connection handler terminated
INFO: 2026/05/18 13:09:03.017994 worker - [tap] (conn #331) transformers applied: [normalize:qname-replace-nonprintable normalize:qname-lowercase]
INFO: 2026/05/18 13:09:03.019114 worker - [tap] dnstap - conn #331 - receiver framestream initialized
ERROR: 2026/05/18 13:09:04.524355 worker - [tap] dnstap - conn #331 - framestream reader error: frame too large error
INFO: 2026/05/18 13:09:04.524383 worker - [tap] dnstap - (conn #331 - connection handler terminated
INFO: 2026/05/18 13:09:04.524440 worker - [tap] dnstap - conn #331 - cleanup the connection handler
INFO: 2026/05/18 13:09:04.524444 worker - [tap] (conn #331) dnstap processor - stopping collect...
INFO: 2026/05/18 13:09:04.524449 worker - [tap] (conn #331) dnstap processor - collection terminated
INFO: 2026/05/18 13:09:04.524452 worker - [tap] (conn #331) dnstap processor - stopping monitor...
INFO: 2026/05/18 13:09:04.524458 worker - [tap] (conn #331) dnstap processor - monitor terminated
INFO: 2026/05/18 13:09:04.524462 worker - [tap] dnstap - conn #331 - cleanup connection handler terminated
INFO: 2026/05/18 13:09:13.014916 worker - [tap] dnstap - conn #332 - new connection from infoblox IP:29278 (name.)
INFO: 2026/05/18 13:09:13.014960 worker - [tap] (conn #332) dnstap processor - enabled
INFO: 2026/05/18 13:09:13.015495 worker - [tap] (conn #332) dnstap processor - starting data collection
INFO: 2026/05/18 13:09:13.015551 worker - [tap] (conn #332) transformers applied: [normalize:qname-replace-nonprintable normalize:qname-lowercase]
INFO: 2026/05/18 13:09:13.015560 worker - [tap] (conn #332) dnstap processor - starting monitoring - refresh every 10s
INFO: 2026/05/18 13:09:13.016421 worker - [tap] dnstap - conn #332 - receiver framestream initialized
ERROR: 2026/05/18 13:09:14.126285 worker - [tap] dnstap - conn #332 - **unexpected control framestream: control frame malformed**
INFO: 2026/05/18 13:09:14.126320 worker - [tap] dnstap - (conn #332 - connection handler terminated
INFO: 2026/05/18 13:09:14.126355 worker - [tap] dnstap - conn #332 - cleanup the connection handler
INFO: 2026/05/18 13:09:14.126367 worker - [tap] (conn #332) dnstap processor - stopping collect...
INFO: 2026/05/18 13:09:14.126373 worker - [tap] (conn #332) dnstap processor - collection terminated
INFO: 2026/05/18 13:09:14.126377 worker - [tap] (conn #332) dnstap processor - stopping monitor...
INFO: 2026/05/18 13:09:14.126387 worker - [tap] (conn #332) dnstap processor - monitor terminated
INFO: 2026/05/18 13:09:14.126392 worker - [tap] dnstap - conn #332 - cleanup connection handler terminated
```

Please let me know if you need any data

**Comment by dmachard** [comment]
Please update to the latest version [(2.3.0-beta6)](https://github.com/dmachard/DNS-collector/releases/tag/v2.3.0-beta6) and let us know if it resolves the issue on your side. Thanks!

**Comment by jerrishjames** [comment]
Unfortunately,  the issue is not fixed with the new beta 6 :(


/INFO: 2026/05/22 10:32:30.012807 worker - [tap] dnstap - conn #12 - new connection from 10.10.10.10:31549 (infoblox.hostname.)
INFO: 2026/05/22 10:32:30.012843 worker - [tap] (conn #12) dnstap processor - enabled
INFO: 2026/05/22 10:32:30.013609 worker - [tap] (conn #12) dnstap processor - starting data collection
INFO: 2026/05/22 10:32:30.013632 worker - [tap] (conn #12) dnstap processor - starting monitoring - refresh every 10s
INFO: 2026/05/22 10:32:30.013680 worker - [tap] (conn #12) transformers applied: [normalize:qname-replace-nonprintable normalize:qname-lowercase]
INFO: 2026/05/22 10:32:30.013809 worker - [tap] dnstap - conn #12 - receiver framestream initialized (data-frame-max-length: 16777216, control-frame-max-length: 65536)
ERROR: 2026/05/22 10:32:31.190117 worker - [tap] dnstap - conn #12 - **framestream reader error: frame too large error**
INFO: 2026/05/22 10:32:31.190151 worker - [tap] dnstap - (conn #12 - connection handler terminated
INFO: 2026/05/22 10:32:31.190189 worker - [tap] dnstap - conn #12 - cleanup the connection handler
INFO: 2026/05/22 10:32:31.190207 worker - [tap] (conn #12) dnstap processor - stopping collect...
INFO: 2026/05/22 10:32:31.190225 worker - [tap] (conn #12) dnstap processor - collection terminated
INFO: 2026/05/22 10:32:31.190235 worker - [tap] (conn #12) dnstap processor - stopping monitor...
INFO: 2026/05/22 10:32:31.190245 worker - [tap] (conn #12) dnstap processor - monitor terminated
INFO: 2026/05/22 10:32:31.190261 worker - [tap] dnstap - conn #12 - cleanup connection handler terminated
INFO: 2026/05/22 10:33:00.013203 worker - [tap] dnstap - conn #13 - new connection from 10.10.10.10:31548 (infoblox.hostname.)
INFO: 2026/05/22 10:33:00.013239 worker - [tap] (conn #13) dnstap processor - enabled
INFO: 2026/05/22 10:33:00.013788 worker - [tap] (conn #13) dnstap processor - starting monitoring - refresh every 10s
INFO: 2026/05/22 10:33:00.013858 worker - [tap] (conn #13) dnstap processor - starting data collection
INFO: 2026/05/22 10:33:00.013942 worker - [tap] (conn #13) transformers applied: [normalize:qname-replace-nonprintable normalize:qname-lowercase]
INFO: 2026/05/22 10:33:00.014002 worker - [tap] dnstap - conn #13 - receiver framestream initialized (data-frame-max-length: 16777216, control-frame-max-length: 65536)
ERROR: 2026/05/22 10:33:00.936059 worker - [tap] dnstap - conn #13 - unexpected control framestream: control frame malformed
INFO: 2026/05/22 10:33:00.936090 worker - [tap] dnstap - (conn #13 - connection handler terminated
INFO: 2026/05/22 10:33:00.936155 worker - [tap] dnstap - conn #13 - cleanup the connection handler
INFO: 2026/05/22 10:33:00.936164 worker - [tap] (conn #13) dnstap processor - stopping collect...
INFO: 2026/05/22 10:33:00.936169 worker - [tap] (conn #13) dnstap processor - collection terminated
INFO: 2026/05/22 10:33:00.936177 worker - [tap] (conn #13) dnstap processor - stopping monitor...
INFO: 2026/05/22 10:33:00.936279 worker - [tap] (conn #13) dnstap processor - monitor terminated
INFO: 2026/05/22 10:33:00.936285 worker - [tap] dnstap - conn #13 - cleanup connection handler terminated
INFO: 2026/05/22 10:33:30.013212 worker - [tap] dnstap - conn #14 - new connection from 10.10.10.10:31547 (infoblox.hostname.)
INFO: 2026/05/22 10:33:30.013249 worker - [tap] (conn #14) dnstap processor - enabled
INFO: 2026/05/22 10:33:30.013814 worker - [tap] (conn #14) dnstap processor - starting data collection
INFO: 2026/05/22 10:33:30.013878 worker - [tap] (conn #14) transformers applied: [normalize:qname-replace-nonprintable normalize:qname-lowercase]
INFO: 2026/05/22 10:33:30.013886 worker - [tap] (conn #14) dnstap processor - starting monitoring - refresh every 10s
INFO: 2026/05/22 10:33:30.014001 worker - [tap] dnstap - conn #14 - receiver framestream initialized (data-frame-max-length: 16777216, control-frame-max-length: 65536)
ERROR: 2026/05/22 10:33:30.801513 worker - [tap] dnstap - conn #14 - unexpected control framestream: control frame malformed
INFO: 2026/05/22 10:33:30.801550 worker - [tap] dnstap - (conn #14 - connection handler terminated
INFO: 2026/05/22 10:33:30.801596 worker - [tap] dnstap - conn #14 - cleanup the connection handler
INFO: 2026/05/22 10:33:30.801621 worker - [tap] (conn #14) dnstap processor - stopping collect...
INFO: 2026/05/22 10:33:30.801638 worker - [tap] (conn #14) dnstap processor - collection terminated
INFO: 2026/05/22 10:33:30.801642 worker - [tap] (conn #14) dnstap processor - stopping monitor...
INFO: 2026/05/22 10:33:30.801649 worker - [tap] (conn #14) dnstap processor - monitor terminated
INFO: 2026/05/22 10:33:30.801654 worker - [tap] dnstap - conn #14 - cleanup connection handler terminated
INFO: 2026/05/22 10:34:00.012810 worker - [tap] dnstap - conn #15 - new connection from 10.10.10.10:31546 (infoblox.hostname.)
INFO: 2026/05/22 10:34:00.012847 worker - [tap] (conn #15) dnstap processor - enabled
INFO: 2026/05/22 10:34:00.013400 worker - [tap] (conn #15) dnstap processor - starting data collection
INFO: 2026/05/22 10:34:00.013433 worker - [tap] (conn #15) dnstap processor - starting monitoring - refresh every 10s
INFO: 2026/05/22 10:34:00.013452 worker - [tap] (conn #15) transformers applied: [normalize:qname-replace-nonprintable normalize:qname-lowercase]
INFO: 2026/05/22 10:34:00.013592 worker - [tap] dnstap - conn #15 - receiver framestream initialized (data-frame-max-length: 16777216, control-frame-max-length: 65536)
ERROR: 2026/05/22 10:34:00.139763 worker - [tap] dnstap - conn #15 - unexpected control framestream: control frame malformed
INFO: 2026/05/22 10:34:00.139784 worker - [tap] dnstap - (conn #15 - connection handler terminated
INFO: 2026/05/22 10:34:00.139836 worker - [tap] dnstap - conn #15 - cleanup the connection handler
INFO: 2026/05/22 10:34:00.139851 worker - [tap] (conn #15) dnstap processor - stopping collect...
INFO: 2026/05/22 10:34:00.139857 worker - [tap] (conn #15) dnstap processor - collection terminated
INFO: 2026/05/22 10:34:00.139862 worker - [tap] (conn #15) dnstap processor - stopping monitor...
INFO: 2026/05/22 10:34:00.139868 worker - [tap] (conn #15) dnstap processor - monitor terminated
INFO: 2026/05/22 10:34:00.139873 worker - [tap] dnstap - conn #15 - cleanup connection handler terminated
INFO: 2026/05/22 10:34:30.013864 worker - [tap] dnstap - conn #16 - new connection from 10.10.10.10:31545 (infoblox.hostname.)
INFO: 2026/05/22 10:34:30.013910 worker - [tap] (conn #16) dnstap processor - enabled
INFO: 2026/05/22 10:34:30.014612 worker - [tap] (conn #16) dnstap processor - starting monitoring - refresh every 10s
INFO: 2026/05/22 10:34:30.014652 worker - [tap] (conn #16) dnstap processor - starting data collection
INFO: 2026/05/22 10:34:30.014728 worker - [tap] (conn #16) transformers applied: [normalize:qname-replace-nonprintable normalize:qname-lowercase]
INFO: 2026/05/22 10:34:30.014786 worker - [tap] dnstap - conn #16 - **receiver framestream initialized (data-frame-max-length: 16777216, control-frame-max-length: 65536)**
ERROR: 2026/05/22 10:34:31.484742 worker - [tap] dnstap - conn #16 - unexpected control framestream: control frame malformed
INFO: 2026/05/22 10:34:31.484772 worker - [tap] dnstap - (conn #16 - connection handler terminated
INFO: 2026/05/22 10:34:31.484839 worker - [tap] dnstap - conn #16 - cleanup the connection handler
INFO: 2026/05/22 10:34:31.484846 worker - [tap] (conn #16) dnstap processor - stopping collect...
INFO: 2026/05/22 10:34:31.484993 worker - [tap] (conn #16) dnstap processor - collection terminated
INFO: 2026/05/22 10:34:31.485004 worker - [tap] (conn #16) dnstap processor - stopping monitor...
INFO: 2026/05/22 10:34:31.485010 worker - [tap] (conn #16) dnstap processor - monitor terminated
INFO: 2026/05/22 10:34:31.485017 worker - [tap] dnstap - conn #16 - cleanup connection handler terminated
INFO: 2026/05/22 10:35:00.013166 worker - [tap] dnstap - conn #17 - new connection from 10.10.10.10:31544 (infoblox.hostname.)
INFO: 2026/05/22 10:35:00.013211 worker - [tap] (conn #17) dnstap processor - enabled
INFO: 2026/05/22 10:35:00.013783 worker - [tap] (conn #17) dnstap processor - starting monitoring - refresh every 10s
INFO: 2026/05/22 10:35:00.013812 worker - [tap] (conn #17) dnstap processor - starting data collection
INFO: 2026/05/22 10:35:00.013880 worker - [tap] (conn #17) transformers applied: [normalize:qname-replace-nonprintable normalize:qname-lowercase]
INFO: 2026/05/22 10:35:00.014264 worker - [tap] dnstap - conn #17 - receiver framestream initialized (data-frame-max-length: 16777216, control-frame-max-length: 65536)
ERROR: 2026/05/22 10:35:00.049954 worker - [tap] dnstap - conn #17 - **unexpected control framestream: control frame malformed**
INFO: 2026/05/22 10:35:00.049988 worker - [tap] dnstap - (conn #17 - connection handler terminated
INFO: 2026/05/22 10:35:00.050029 worker - [tap] dnstap - conn #17 - cleanup the connection handler
INFO: 2026/05/22 10:35:00.050050 worker - [tap] (conn #17) dnstap processor - stopping collect...
INFO: 2026/05/22 10:35:00.050059 worker - [tap] (conn #17) dnstap processor - collection terminated
INFO: 2026/05/22 10:35:00.050066 worker - [tap] (conn #17) dnstap processor - stopping monitor...
INFO: 2026/05/22 10:35:00.050074 worker - [tap] (conn #17) dnstap processor - monitor terminated
INFO: 2026/05/22 10:35:00.050079 worker - [tap] dnstap - conn #17 - cleanup connection handler terminated
INFO: 2026/05/22 10:35:30.013330 worker - [tap] dnstap - conn #18 - new connection from 10.10.10.10:31543 (infoblox.hostname.)
INFO: 2026/05/22 10:35:30.013389 worker - [tap] (conn #18) dnstap processor - enabled
INFO: 2026/05/22 10:35:30.014212 worker - [tap] (conn #18) dnstap processor - starting data collection
INFO: 2026/05/22 10:35:30.014292 worker - [tap] (conn #18) transformers applied: [normalize:qname-replace-nonprintable normalize:qname-lowercase]
INFO: 2026/05/22 10:35:30.014312 worker - [tap] (conn #18) dnstap processor - starting monitoring - refresh every 10s
INFO: 2026/05/22 10:35:30.014398 worker - [tap] dnstap - conn #18 - receiver framestream initialized (data-frame-max-length: 16777216, control-frame-max-length: 65536)
ERROR: 2026/05/22 10:35:31.257828 worker - [tap] dnstap - conn #18 - **framestream reader error: frame too large error**
INFO: 2026/05/22 10:35:31.257877 worker - [tap] dnstap - (conn #18 - connection handler terminated
INFO: 2026/05/22 10:35:31.257921 worker - [tap] dnstap - conn #18 - cleanup the connection handler
INFO: 2026/05/22 10:35:31.257939 worker - [tap] (conn #18) dnstap processor - stopping collect...
INFO: 2026/05/22 10:35:31.257949 worker - [tap] (conn #18) dnstap processor - collection terminated
INFO: 2026/05/22 10:35:31.257959 worker - [tap] (conn #18) dnstap processor - stopping monitor...
INFO: 2026/05/22 10:35:31.257966 worker - [tap] (conn #18) dnstap processor - monitor terminated
INFO: 2026/05/22 10:35:31.257971 worker - [tap] dnstap - conn #18 - cleanup connection handler terminated/


[pcap5-22.csv](https://github.com/user-attachments/files/28142150/pcap5-22.csv)

attached new pcap and the error which you can correlate ..Please let me know if you need any details extra

Fyi:  We send logs from different dns server(src) to the same collector , just wondering is that causing the issue (Multiple senders or mixed traffic accidentally hit the same port)?

in X11 packet it transmit this 

```
0000   00 00 00 00 00 00 00 22 00 00 00 04 00 00 00 01   ......."........
0010   00 00 00 16 70 72 6f 74 6f 62 75 66 3a 64 6e 73   ....protobuf:dns
0020   74 61 70 2e 44 6e 73 74 61 70                     tap.Dnstap
```

**Comment by dmachard** [comment]
Thanks again for the detailed reports and captures. Infoblox's control frames appear to be structurally non-compliant with the FrameStream spec in a way that go-framestream currently rejects as malformed. 

Every other dnstap implementation (BIND, Unbound, PowerDNS, Knot) works fine with dns-collector, so I'm not in a position to add Infoblox-specific workarounds without their direct involvement. Leaving this open for the community or Infoblox to pick up.

That said, I'd be happy to review and merge any external PR addressing this, whether it's a more lenient control frame parser or an Infoblox-specific compatibility fix.

**Comment by jerrishjames** [comment]
Thanks for the explanation and the work that you did.

I understand that Infoblox may not change their implementation easily, but I’d like to check with them anyway.

Could you clarify what exact details you would need from the vendor to better understand or potentially address this? 

For example:
- Which part of the FrameStream spec their control frames seem to violate
- What fields or structure are considered malformed
- Whether specific examples of valid vs invalid frames would help

I can try to gather this information from Infoblox support if I know exactly what to ask for.

**Comment by dmachard** [comment]
From what I see, this is likely not specific to DNS-collector itself, but rather a FrameStream implementation mismatch between sender (Infoblox) and receiver (go-framestream / fstrm spec assumptions).

For context, DNS-collector uses a Go implementation: https://github.com/dmachard/go-framestream This is based on the official C implementation: https://github.com/farsightsec/fstrm

In the upstream C library, the relevant limits are:
- FSTRM_CONTROL_FRAME_LENGTH_MAX = 512 (control frame payload max size)
- FSTRM_READER_MAX_FRAME_SIZE_DEFAULT = 1048576 (default max data frame size)

So in “reference” implementations, **control frames are expected to remain very small** (hundreds of bytes range), not KB-sized payloads.

It might be useful to test with the official reference implementation: https://github.com/farsightsec/fstrm/releases
If the same Infoblox stream is rejected there as well, it would confirm:
- this is not DNS-collector specific
- but a compatibility issue at FrameStream level (or Infoblox interpretation of the spec)

From Infoblox side, the key missing piece is the exact specification of their FrameStream control handshake (START/ACCEPT payload structure) or and the expected successful handshake.

**Comment by rmbolger** [comment]
@jerrishjames Out of curiosity, what version of NIOS have you been testing against?

I ask because we're just starting to evaluate this as well against the latest 9.1.0 release which has some significant changes to DNSTAP support according to the release notes. We hadn't previously been able to use it prior to 9.1 because the older versions required the DNS Cache Acceleration engine which we didn't have licensed. But the new version can supposedly use BIND's native DNSTAP implementation instead of the one dependent on DNS Cache Acceleration.

I haven't actually deployed anything yet. So I don't have any compatibility results to share. But I'll definitely report back when I do.

**Comment by edmonds** [comment]
@dmachard:
> In the upstream C library, the relevant limits are:
> 
>     * FSTRM_CONTROL_FRAME_LENGTH_MAX = 512 (control frame payload max size)
> 
>     * FSTRM_READER_MAX_FRAME_SIZE_DEFAULT = 1048576 (default max data frame size)
> 
> 
> So in “reference” implementations, **control frames are expected to remain very small** (hundreds of bytes range), not KB-sized payloads.

That's correct, the original set of control frames defined for Frame Streams (START, STOP, ACCEPT, READY, and FINISH) are quite small and are just signals used to set up and shut down the stream. The content type strings used in the handshake negotiation could plausibly add up to a few dozen bytes. So the 512 byte limit allowed by the fstrm library was already generous, and the ~4K allowed by DNS-collector is very generous.

@jerrishjames:
> we observed a control frame of ~10.9 KB from an Infoblox .

That's very suspicious and I would suspect either a bug or a substantial amount of non-standard protocol content being sent by the Infoblox device. If the latter, it would be kind of weird to send it as a control frame, though.

Looking at the page linked above (https://docs.infoblox.com/space/nios90/1432781072/Protobuf+Template+for+Infoblox+dnstap) they have made proprietary changes directly to the protobuf schema (compare to the official schema at https://github.com/dnstap/dnstap.pb/blob/main/dnstap.proto to see which lines were added by them). E.g., starting at field 15 in the `Message` schema they've started squatting on field ID assignments.

The "right" way to extend a dnstap protobuf payload with vendor-specific data is to use the "extra" field, which is what I did in [dnstap-utils](https://github.com/fastly/dnstap-utils) when I wanted to record mismatched replayed data. If they didn't want to do that and preferred the convenience of directly editing the protobuf schema without concern for interoperability, it would have been better to change the content type sent in the Frame Streams handshake from `protobuf:dnstap.Dnstap` to some other string like `protobuf:com.infoblox.Dnstap`, which it seems they also didn't do, looking at the hex dumps above. If they had done that, then receivers would be able to unambiguously interpret their protobuf payloads and avoid confusing them with payloads that use the "official" schema (https://github.com/dnstap/dnstap.pb/blob/main/dnstap.proto).

Given that they've made incompatible changes to the protobuf schema it's possible they've also made incompatible changes to the Frame Streams protocol as well.

**Comment by rmbolger** [comment]
Following up on my previous message. We've now done some testing with NIOS 9.1.0 against DNS-collector 2.4.0 and I can confirm Infoblox now has two different engines capable of sending DNSTAP traffic. There is the DNS Cache Acceleration engine which you get with that license or the DNS Infrastructure Protection license and there is the normal BIND engine (which is a variant of BIND 9.20 in NIOS 9.1.0). Unfortunately, you don't have a choice as to which engine gets used. If you have the licenses capable of using the DCA engine, DNSTAP will always use that engine. Otherwise, it will use the BIND engine.

On members using the BIND engine, I've had no problems so far. Everything seems to work as expected. I've only just started testing against members running the DCA engine, so I can't say for sure whether it will have the same issues as @jerrishjames. But there there are additional limitations in the UI when using the DCA engine like the inability to change the filtering options for the types of queries and responses to send which I've got a support case open about. If your collector is configured with a DNS name rather than an IP and the IP of the record changes, the DCA engine also seems incapable of recognizing that change without a services restart (which is supremely ironic for a DNS appliance).

**Comment by jerrishjmz** [comment]
Hi 

After some testing it seems like we found the issue and it was indeed infoblox.

So the support has a hotfix for this NIOS-109824 Major When DNSTAP was configured, invalid protobuf packets with no data were 
sent to the DNSTAP receiver, causing it to disconnect.

we are in 9.0.7 which is only capable of sending logs with the TP license installed however we are not using any other capabilities for this service other than the logs.

and now it seems like working fine :)


in future we will be upgrading to 9.2 LTS (may release in next 2 months) and we will be using only bind engine powered dnstap :) 

thanks  for the help :)

**Comment by dmachard** [comment]
Hi @jerrishjmz,

Thank you very much for following up and sharing the root cause! This will be extremely helpful for other users running Infoblox NIOS.

Glad to hear everything is now working as expected. Closing this issue.
